{
  "$schema": "http://json-schema.org/draft-07/schema#",
  "$id": "https://jam-bot.com/schemas/task-json/v0.1.3.json",
  "title": "JamBot task.json (canonical v0.1.3)",
  "description": "v0.1.1 baseline + v0.2 Rule 9: failure_modes enum-constrained to 21-value vocabulary. Rule 8 fields remain PENDING_HOST_CONFIRM at this layer (flip happens at v0.1.2, orthogonal to this patch).",
  "type": "object",
  "additionalProperties": false,
  "required": [
    "id",
    "state",
    "raised_at",
    "raised_by",
    "source_ref",
    "summary",
    "tenant",
    "operator_phone",
    "email_authorized_by_mike",
    "recipient",
    "state_history",
    "clerk_session_id",
    "lock_required",
    "defer_count",
    "failure_modes"
  ],
  "properties": {
    "id": {
      "type": "string",
      "pattern": "^\\d{4}-\\d{2}-\\d{2}-\\d{4}-[a-z0-9][a-z0-9-]*$",
      "description": "<YYYY-MM-DD>-<HHMM>-<slug>"
    },
    "state": {
      "type": "string",
      "enum": ["intake", "shop-floor", "planned", "scheduled", "today", "done", "in-flight", "parked"]
    },
    "raised_at": {
      "type": "string",
      "pattern": "^\\d{4}-\\d{2}-\\d{2}T\\d{2}:\\d{2}:\\d{2}Z$"
    },
    "raised_by": {
      "type": "string",
      "enum": ["voice", "mesh", "brief", "manual", "sms", "email"],
      "description": "Intake channel. 'email' added per Rule 7 (folded into Rule 8 amendment)."
    },
    "source_ref": {
      "type": ["string", "null"],
      "description": "Mesh filename / transcript line / sms-sid / gmail-thread-id."
    },
    "summary": {
      "type": "string",
      "minLength": 1,
      "maxLength": 120
    },
    "tenant": {
      "type": "string",
      "minLength": 1
    },
    "operator_phone": {
      "type": ["string", "null"],
      "description": "Only SMS-origin tasks populate. bun-desktop wanted this cut; src-desktop wanted it kept — resolution: keep but nullable."
    },
    "email_authorized_by_mike": {
      "type": ["string", "null"],
      "pattern": "^\\d{4}-\\d{2}-\\d{2}T\\d{2}:\\d{2}:\\d{2}Z$",
      "description": "Rule 1: must be set together with `recipient`."
    },
    "recipient": {
      "type": ["string", "null"],
      "description": "Rule 1: must be set together with `email_authorized_by_mike`."
    },
    "scheduled_at": {
      "type": ["string", "null"],
      "pattern": "^\\d{4}-\\d{2}-\\d{2}T\\d{2}:\\d{2}:\\d{2}Z$"
    },
    "parked_until": {
      "type": ["string", "null"],
      "pattern": "^\\d{4}-\\d{2}-\\d{2}T\\d{2}:\\d{2}:\\d{2}Z$"
    },
    "completed_at": {
      "type": ["string", "null"],
      "pattern": "^\\d{4}-\\d{2}-\\d{2}T\\d{2}:\\d{2}:\\d{2}Z$"
    },
    "outcome": {
      "type": ["string", "null"]
    },
    "state_history": {
      "type": "array",
      "description": "Append-only audit trail (bun-desktop). Can be empty but must be present.",
      "items": {
        "type": "object",
        "additionalProperties": false,
        "required": ["state", "at", "by"],
        "properties": {
          "state": {
            "type": "string",
            "enum": ["intake", "shop-floor", "planned", "scheduled", "today", "done", "in-flight", "parked"]
          },
          "at": {
            "type": "string",
            "pattern": "^\\d{4}-\\d{2}-\\d{2}T\\d{2}:\\d{2}:\\d{2}Z$"
          },
          "by": {
            "type": "string",
            "minLength": 1,
            "description": "Agent URI (e.g. josh-desktop@mesh)."
          }
        }
      }
    },
    "clerk_session_id": {
      "type": ["string", "null"],
      "description": "src-desktop: voice-session binding."
    },
    "lock_required": {
      "type": "boolean",
      "description": "src-desktop: false for background tasks (digest cron, blocker sweeps); default true."
    },
    "defer_count": {
      "type": "integer",
      "minimum": 0,
      "description": "src-desktop: lock-and-defer yield counter; default 0."
    },
    "failure_modes": {
      "type": "array",
      "description": "v0.2 Rule 9 — closed enum of 21 values. Empty list permitted but discouraged. Source of truth: /agent-desk/snapshots/2026-05-19-failure-modes-enum/failure-modes-enum-v0.2.md",
      "items": {
        "type": "string",
        "enum": [
          "blocker_source_split_brain",
          "completion_signal_ambiguous",
          "cross_session_artifact_handoff_blindness",
          "deadlock_on_missing_signal",
          "decision_matrix_skipped_failure_mode_first_pass",
          "false_negative_active_state",
          "false_positive_active_state",
          "in_flight_orphan",
          "interleave_corruption",
          "latency_budget_exceeded",
          "orphan_after_crash",
          "outbound_recipient_drift",
          "parallel_shift_writer_race",
          "parked_without_clock",
          "permission_drift_breaks_protocol_channel",
          "schema_field_unenforced",
          "sentinel_traps_silent_skip",
          "silent_drift",
          "transition_illegal",
          "voice_agent_is_executor_but_no_task_record",
          "worker_self_report_passed_but_unverified"
        ]
      }
    },
    "dedup_hash": {
      "type": ["string", "null"],
      "description": "Rule 8 amendment — PENDING_HOST_CONFIRM at v0.1.1; flips to required at v0.1.2 (orthogonal to this v0.1.3 ratchet)."
    },
    "recipient_role": {
      "type": ["string", "null"],
      "enum": ["mike", "operator", "client", "other", null],
      "description": "Rule 8 amendment — PENDING_HOST_CONFIRM at v0.1.1; flips to required at v0.1.2 (orthogonal to this v0.1.3 ratchet)."
    },
    "linked_to": {
      "type": "array",
      "items": {"type": "string"},
      "description": "Rule 8 amendment — PENDING_HOST_CONFIRM at v0.1.1; flips to required at v0.1.2 (orthogonal to this v0.1.3 ratchet). Task-ids this dedupes with; default []."
    }
  },
  "allOf": [
    {
      "description": "Rule 1 cross-field: email_authorized_by_mike and recipient must BOTH be set or BOTH be null.",
      "oneOf": [
        {
          "properties": {
            "email_authorized_by_mike": {"type": "null"},
            "recipient": {"type": "null"}
          }
        },
        {
          "properties": {
            "email_authorized_by_mike": {"type": "string"},
            "recipient": {"type": "string"}
          },
          "required": ["email_authorized_by_mike", "recipient"]
        }
      ]
    },
    {
      "description": "scheduled / today / done states must carry scheduled_at.",
      "if": {
        "properties": {"state": {"enum": ["scheduled", "today", "done"]}}
      },
      "then": {
        "required": ["scheduled_at"]
      }
    },
    {
      "description": "parked state must carry parked_until.",
      "if": {
        "properties": {"state": {"const": "parked"}}
      },
      "then": {
        "required": ["parked_until"]
      }
    },
    {
      "description": "done state must carry completed_at and outcome.",
      "if": {
        "properties": {"state": {"const": "done"}}
      },
      "then": {
        "required": ["completed_at", "outcome"]
      }
    }
  ]
}
