{
  "id": "2026-05-18-1030-voice-cabinet-design-review",
  "state": "intake",
  "raised_at": "2026-05-18T10:30:00Z",
  "raised_by": "voice",
  "source_ref": "ovu-voice-session-2c8d4f6a1b9e",
  "summary": "Voice-origin: review kitchen cabinet design mockup with operator over voice",
  "tenant": "smoke-test-tenant",
  "operator_phone": "+14165550100",
  "email_authorized_by_mike": null,
  "recipient": null,
  "scheduled_at": null,
  "parked_until": null,
  "completed_at": null,
  "outcome": null,
  "state_history": [
    {"state": "intake", "at": "2026-05-18T10:30:00Z", "by": "voice-agent@josh-desktop"}
  ],
  "clerk_session_id": "sess_clerk_2lYx9aB3CdEfGhIjKlMnOpQr",
  "lock_required": true,
  "defer_count": 0,
  "failure_modes": [],
  "dedup_hash": "smoke-test-tenant:ovu-voice-session-2c8d4f6a1b9e:cabinet-design",
  "recipient_role": "operator",
  "linked_to": []
}
